{"$schema":"https://json-schema.org/draft/2020-12/schema","$id":"https://sister.dev/contracts/federation/1.0.0/federated-system-manifest.schema.json","type":"object","required":["system_id","system_version","owner","capabilities","operational_status","maturity"],"additionalProperties":false,"properties":{"system_id":{"type":"string","minLength":1},"system_version":{"type":"string","minLength":1},"owner":{"type":"string","minLength":1},"operational_status":{"enum":["active","degraded","inactive","suspended"]},"maturity":{"enum":["experimental","pre-alpha","alpha","beta","production"]},"capabilities":{"type":"array","minItems":1,"items":{"type":"object","required":["capability_id","version","contract"],"additionalProperties":false,"properties":{"capability_id":{"type":"string","minLength":1},"version":{"type":"string","minLength":1},"contract":{"type":"string","minLength":1}}},"uniqueItems":true}}}
